{
  "$schema": "https://json-schema.org/draft/2020-12/schema",
  "$id": "https://ghassenelkamel.github.io/portfolio-content/schemas/experience.schema.json",
  "type": "object",
  "additionalProperties": false,
  "required": ["schemaVersion", "updatedAt", "eyebrow", "title", "description", "items"],
  "properties": {
    "schemaVersion": { "const": 1 },
    "updatedAt": {
      "type": "string",
      "pattern": "^\\d{4}-\\d{2}-\\d{2}T\\d{2}:\\d{2}:\\d{2}Z$"
    },
    "eyebrow": { "type": "string", "minLength": 1 },
    "title": { "type": "string", "minLength": 1 },
    "description": { "type": "string", "minLength": 1 },
    "items": {
      "type": "array",
      "minItems": 1,
      "items": {
        "type": "object",
        "additionalProperties": false,
        "required": ["id", "role", "org", "dates", "location", "summary", "sortOrder"],
        "properties": {
          "id": { "type": "string", "minLength": 1 },
          "role": { "type": "string", "minLength": 1 },
          "org": { "type": "string", "minLength": 1 },
          "dates": { "type": "string", "minLength": 1 },
          "location": { "type": "string", "minLength": 1 },
          "summary": {
            "type": "array",
            "minItems": 1,
            "items": { "type": "string", "minLength": 1 }
          },
          "bullets": {
            "type": "array",
            "items": { "type": "string", "minLength": 1 }
          },
          "image": {
            "type": "string",
            "anyOf": [
              { "pattern": "^assets/.+" },
              { "format": "uri" }
            ]
          },
          "proofUrl": {
            "type": "string",
            "format": "uri"
          },
          "featured": { "type": "boolean" },
          "sortOrder": { "type": "integer", "minimum": 0 }
        }
      }
    }
  }
}
