{
  "schemaVersion": 1,
  "updatedAt": "2026-05-02T18:00:00Z",
  "eyebrow": "Expérience",
  "title": "Parcours Professionnel",
  "description": "Sélectionnez une expérience pour explorer le périmètre, l'impact et les outils utilisés.",
  "items": [
    {
      "id": "spade-integrity-2024",
      "role": "Ingénieur IoT",
      "org": "Spade Integrity",
      "dates": "Mai 2024 - Présent · 2 ans 1 mois",
      "location": "Sur site",
      "summary": [
        "Conception et évolution d'une plateforme client avec un fort niveau d'exigence sur la fiabilité, la sécurité et la continuité de service.",
        "Mise en place de flux de récupération sécurisée des données, intégration NAS et mécanismes de synchronisation pour les alarmes et les données critiques.",
        "Contribution aux livraisons IoT/backend de bout en bout via l'amélioration des pipelines de données, du monitoring et des intégrations sécurisées."
      ],
      "bullets": ["Go", "Plateforme IoT", "Récupération sécurisée", "Intégration NAS", "Synchronisation des alarmes", "Monitoring", "Infrastructure"],
      "image": "assets/spade-integrity.svg",
      "sortOrder": 10
    },
    {
      "id": "bookbeo-2023",
      "role": "Développeur Mobile Full Stack",
      "org": "bookBeo",
      "dates": "Mars 2023 - Sept 2023 · 7 mois",
      "location": "Rennes, Bretagne, France · Sur site",
      "summary": [
        "Développement de fonctionnalités mobiles et de workflows connectés au backend dans un contexte de livraison en stage.",
        "Contribution à la qualité des releases et à la rapidité d'implémentation grâce à des pratiques d'équipe structurées et une discipline Git rigoureuse."
      ],
      "bullets": ["GitLab", "Git", "React Native", "Intégration API", "Livraison produit", "Performance", "Collaboration équipe"],
      "image": "assets/p7.jpg",
      "sortOrder": 20
    },
    {
      "id": "st-2022",
      "role": "Membre d'équipe projet sécurité",
      "org": "STMicroelectronics",
      "dates": "Sept 2022 - Mars 2023",
      "location": "Le Mans, France · Sur site",
      "summary": [
        "Implémentation de l'API PSA Crypto dans un contexte embarqué avec de fortes contraintes de sécurité.",
        "Développement en C avec des workflows Git structurés et des outils de validation sous Linux."
      ],
      "bullets": ["C", "PSA Crypto", "Sécurité embarquée", "Outils Linux"],
      "image": "assets/p6.jpg",
      "sortOrder": 30
    },
    {
      "id": "falcon-2022",
      "role": "Expérience Développement Mobile",
      "org": "Falcon Inspection & Services",
      "dates": "Juin 2022 - Aout 2022",
      "location": "Tunis, Tunisie · Sur site",
      "summary": [
        "Conception d'un workflow mobile pour l'enregistrement et la validation de plusieurs tests industriels sur le terrain.",
        "Implémentation de modèles de données par test et de règles de validation pour améliorer la cohérence des rapports."
      ],
      "bullets": ["Flutter", "Node.js", "Flux de validation", "Docker"],
      "image": "assets/p5.jpg",
      "sortOrder": 40
    },
    {
      "id": "dall-2021",
      "role": "Monitoring météo et stockage des données",
      "org": "DigiArtLivingLab",
      "dates": "Juil 2021 - Aout 2021",
      "location": "Tunis, Tunisie · Sur site",
      "summary": [
        "Automatisation de la collecte et du stockage de données météo pour un suivi continu.",
        "Développement de modules UI et d'intégrations API avec parsing JSON et persistance backend."
      ],
      "bullets": ["Java", "JavaFX", "Intégration API", "Automatisation"],
      "image": "assets/p1.jpg",
      "sortOrder": 50
    },
    {
      "id": "sagemcom-2020",
      "role": "Validation de composants électroniques",
      "org": "SAGEMCOM",
      "dates": "Fev 2020 - Mai 2020",
      "location": "Tunis, Tunisie · Sur site",
      "summary": [
        "Développement de workflows LabView pour la détection et la qualification de composants électroniques.",
        "Entraînement d'un modèle CNN et déploiement d'une version légère d'inférence sur Raspberry Pi."
      ],
      "bullets": ["LabView", "CNN", "TensorFlow Lite", "Raspberry Pi", "SolidWorks"],
      "image": "assets/p2.jpg",
      "proofUrl": "https://drive.google.com/file/d/1HEhe-tPGshCTeTujwacxx_Wc-qHJIF3j/view",
      "sortOrder": 60
    },
    {
      "id": "dall-2019",
      "role": "Station IoT + applications mobiles",
      "org": "DigiArtLivingLab",
      "dates": "Janv 2019 - Fev 2019",
      "location": "Tunis, Tunisie · Sur site",
      "summary": [
        "Développement de solutions de capteurs Arduino avec communication Bluetooth.",
        "Création d'applications Android compagnon avec synchronisation temps réel des données."
      ],
      "bullets": ["Arduino", "Bluetooth", "MIT App Inventor", "Firebase"],
      "image": "assets/p3.jpg",
      "sortOrder": 70
    },
    {
      "id": "dall-2018",
      "role": "Développement de jeu éducatif",
      "org": "DigiArtLivingLab",
      "dates": "Janv 2018 - Fev 2018",
      "location": "Nabeul, Tunisie · Sur site",
      "summary": [
        "Réalisation d'un jeu éducatif Unity axé sur l'apprentissage des directions pour enfants.",
        "Coordination des assets, du pacing des niveaux et du polish gameplay au sein d'une petite équipe."
      ],
      "bullets": ["Unity", "Gameplay design", "Collaboration équipe", "Bases C++"],
      "image": "assets/p4.jpg",
      "sortOrder": 80
    }
  ]
}
